{
  "action_contract_id": "robot.tank.pick",
  "geometry": [
    {
      "geometry_path": "vendor/DOBOT_6Axis_ROS2_V4/dobot_rviz/meshes/cr5/base_link.STL",
      "geometry_sha256": "fd150ed669f6fdeccb5c83e7e3f4cc45dc20c8b325706bc6c587460b6df285d2",
      "link_id": "base_link",
      "local_aabb": {
        "max_m": [
          0.074003025889,
          0.119894817472,
          0.071000002325
        ],
        "min_m": [
          -0.074003018439,
          -0.074006155133,
          1.788e-09
        ]
      },
      "triangle_count": 3752
    },
    {
      "geometry_path": "vendor/DOBOT_6Axis_ROS2_V4/dobot_rviz/meshes/cr5/J1.STL",
      "geometry_sha256": "95ef34b610de5d57022741210c1c2a69bc1f39fb5936690ad654772630fcb784",
      "link_id": "Link1",
      "local_aabb": {
        "max_m": [
          0.061542496085,
          0.061410997063,
          0.083499997854
        ],
        "min_m": [
          -0.061501372606,
          -0.071000002325,
          -0.082999996841
        ]
      },
      "triangle_count": 5346
    },
    {
      "geometry_path": "vendor/DOBOT_6Axis_ROS2_V4/dobot_rviz/meshes/cr5/J2.STL",
      "geometry_sha256": "4036af634963d9e636c977d774fbd3769ba75adde2516ac9769a8ecb4eb21fa8",
      "link_id": "Link2",
      "local_aabb": {
        "max_m": [
          0.061410978436,
          0.061535771936,
          0.230499997735
        ],
        "min_m": [
          -0.488410830498,
          -0.061884429306,
          0.06400000304
        ]
      },
      "triangle_count": 8370
    },
    {
      "geometry_path": "vendor/DOBOT_6Axis_ROS2_V4/dobot_rviz/meshes/cr5/J3.STL",
      "geometry_sha256": "641440b1cf67a13ad1b9dc299ba1df0796347fa902cbed25f8fff4209e61516e",
      "link_id": "Link3",
      "local_aabb": {
        "max_m": [
          0.061381913722,
          0.061381816864,
          0.095999993384
        ],
        "min_m": [
          -0.399383485317,
          -0.061381813139,
          -0.05150000006
        ]
      },
      "triangle_count": 5410
    },
    {
      "geometry_path": "vendor/DOBOT_6Axis_ROS2_V4/dobot_rviz/meshes/cr5/J4.STL",
      "geometry_sha256": "12a742a06daa0590657b40264e829eebcb70343db5418f3941b5b160c32bfcc1",
      "link_id": "Link4",
      "local_aabb": {
        "max_m": [
          0.042389612645,
          0.07650000602,
          0.042383376509
        ],
        "min_m": [
          -0.042389612645,
          -0.071000002325,
          -0.04900001362
        ]
      },
      "triangle_count": 5122
    },
    {
      "geometry_path": "vendor/DOBOT_6Axis_ROS2_V4/dobot_rviz/meshes/cr5/J5.STL",
      "geometry_sha256": "6ac9837dcb0604cc22acb26a7de77e18747cc89a2666948911df44e057a85acb",
      "link_id": "Link5",
      "local_aabb": {
        "max_m": [
          0.042395163327,
          0.070799998939,
          0.042383395135
        ],
        "min_m": [
          -0.042395163327,
          -0.090199999511,
          -0.04900001362
        ]
      },
      "triangle_count": 6816
    },
    {
      "geometry_path": "vendor/DOBOT_6Axis_ROS2_V4/dobot_rviz/meshes/cr5/J6.STL",
      "geometry_sha256": "b969c8f0f7db193647969173f9c98dd3a36027b8372f95cbaf148fae0322ffb9",
      "link_id": "Link6",
      "local_aabb": {
        "max_m": [
          0.040963061154,
          0.041000001132,
          -7.96e-10
        ],
        "min_m": [
          -0.041000001132,
          -0.049500003457,
          -0.038200005889
        ]
      },
      "triangle_count": 5948
    }
  ],
  "kinematic_model": {
    "base_registration": {
      "matrix_robot_base_to_world": [
        [
          1.0,
          0.0,
          0.0,
          -0.331431147
        ],
        [
          0.0,
          1.0,
          0.0,
          -0.001677236
        ],
        [
          0.0,
          0.0,
          1.0,
          0.178497249
        ],
        [
          0.0,
          0.0,
          0.0,
          1.0
        ]
      ],
      "reference_rail_position_mm": 500.0,
      "reference_rail_slot": 4,
      "relative_rail_shift_m": [
        -0.1,
        0.0,
        0.0
      ],
      "source": "calibration-gltf-reference-plus-rigged-rail-shift",
      "status": "candidate-unqualified",
      "target_rail_position_mm": 600.0,
      "target_rail_slot": 5
    },
    "controller_to_model": {
      "equation": "q_model_deg=sign*q_controller_deg+zero_offset_deg",
      "sign": [
        1.0,
        1.0,
        1.0,
        1.0,
        1.0,
        1.0
      ],
      "zero_offset_deg": [
        0.14688754,
        -0.11469849,
        0.07261087,
        -0.02898851,
        0.22621536,
        -0.06467217
      ]
    },
    "joint_ids": [
      "J1",
      "J2",
      "J3",
      "J4",
      "J5",
      "J6"
    ],
    "link_order": [
      "base_link",
      "Link1",
      "Link2",
      "Link3",
      "Link4",
      "Link5",
      "Link6"
    ],
    "model_id": "dobot-cr5",
    "root_link": "base_link"
  },
  "limitations": [
    "full-machine-gltf-registration-not-proxy-collision-scene-frame",
    "rail-slot-shift-is-candidate-unqualified-registration",
    "cr5-skeleton-not-verified-equivalent-to-field-cr5a",
    "dynamic-tool-geometry-missing",
    "payload-attachment-geometry-missing",
    "tool-rotary-kinematics-missing",
    "compiled-move-l-terminal-is-software-derived-not-refreshed-hardware-joint",
    "collision-qualified-false"
  ],
  "mode": "shadow",
  "qualification": "candidate",
  "sample_id": "eit-ptlc-historical-v1",
  "schema": "lab.spatial-link-state-sequence/v0",
  "sequence_digest": "15fcffae7b74e0817c9fa17f01298978ad679c0eb4ec01f2c92c9e05748031cb",
  "source_digests": {
    "cr5-base-collision": "fd150ed669f6fdeccb5c83e7e3f4cc45dc20c8b325706bc6c587460b6df285d2",
    "cr5-j1-collision": "95ef34b610de5d57022741210c1c2a69bc1f39fb5936690ad654772630fcb784",
    "cr5-j2-collision": "4036af634963d9e636c977d774fbd3769ba75adde2516ac9769a8ecb4eb21fa8",
    "cr5-j3-collision": "641440b1cf67a13ad1b9dc299ba1df0796347fa902cbed25f8fff4209e61516e",
    "cr5-j4-collision": "12a742a06daa0590657b40264e829eebcb70343db5418f3941b5b160c32bfcc1",
    "cr5-j5-collision": "6ac9837dcb0604cc22acb26a7de77e18747cc89a2666948911df44e057a85acb",
    "cr5-j6-collision": "b969c8f0f7db193647969173f9c98dd3a36027b8372f95cbaf148fae0322ffb9",
    "cr5-urdf": "6e96f0434624e12570d8a8fcd2add9c37d6605245f69c9063cad5d686803f84f",
    "motion-contract": "5856f0aa8e06519191fc45757aed70dff433761ca5815aeac8a12dc1c7bcc775",
    "rail-points": "43e957acf2c7cb58b5bc45787d7106b835a8fdc8b264c76dc2df1e3c8df79d13",
    "robot-calibration": "582c0472c4bae565c87443b0252578fdd2f1092e24790c29ea5ffd360efc97fa",
    "robot-points": "d4d8a03ee3e9dfb248c6d9eee69b12d69a7069d41aaf9fadada644fd7cd14c00",
    "robot-rig-map": "4f4920d8e9a0b572fa8c73a3b8d1c9df5b23586ce25ea8611f3190b5c46ce69c",
    "tank1-pick-compiled-clip": "b7eda74614e24d94c1eeaddae28b8288e11457be995e36527f9f7009b583dde3"
  },
  "states": [
    {
      "controller_joint_deg": [
        -154.523621,
        -47.783794,
        93.294029,
        44.639656,
        -89.062752,
        124.999908
      ],
      "links": [
        {
          "link_id": "base_link",
          "matrix_link_to_world": [
            [
              1.0,
              0.0,
              0.0,
              -0.331431147
            ],
            [
              0.0,
              1.0,
              0.0,
              -0.001677236
            ],
            [
              0.0,
              0.0,
              1.0,
              0.178497249
            ],
            [
              0.0,
              0.0,
              0.0,
              1.0
            ]
          ],
          "world_aabb": {
            "max_m": [
              -0.257428121111,
              0.118217581472,
              0.249497251325
            ],
            "min_m": [
              -0.405434165439,
              -0.075683391133,
              0.178497250788
            ]
          }
        },
        {
          "link_id": "Link1",
          "matrix_link_to_world": [
            [
              -0.901656991655,
              0.43245192727,
              0.0,
              -0.331431147
            ],
            [
              -0.43245192727,
              -0.901656991655,
              0.0,
              -0.001677236
            ],
            [
              0.0,
              0.0,
              1.0,
              0.325497249
            ],
            [
              0.0,
              0.0,
              0.0,
              1.0
            ]
          ],
          "world_aabb": {
            "max_m": [
              -0.249420700358,
              0.088936799617,
              0.408997246854
            ],
            "min_m": [
              -0.417625456721,
              -0.083663061907,
              0.242497252159
            ]
          }
        },
        {
          "link_id": "Link2",
          "matrix_link_to_world": [
            [
              0.66899519863,
              -0.604511058078,
              -0.432448615297,
              -0.331431147
            ],
            [
              0.320859861671,
              -0.289932326656,
              0.901658580133,
              -0.001677236
            ],
            [
              -0.670443415494,
              -0.741960663796,
              1.3e-11,
              0.325497249
            ],
            [
              0.0,
              0.0,
              0.0,
              1.0
            ]
          ],
          "world_aabb": {
            "max_m": [
              -0.280614388138,
              0.243801679297,
              0.698864886613
            ],
            "min_m": [
              -0.795054107011,
              -0.118523725173,
              0.238667540677
            ]
          }
        },
        {
          "link_id": "Link3",
          "matrix_link_to_world": [
            [
              -0.642754626123,
              -0.632340640577,
              -0.432448615297,
              -0.616881327989
            ],